{
  "schema": "adaos.workflow.definition.v1",
  "workflow_type": "prototype.service_request",
  "definition_version": "1.0.0",
  "aggregate_type": "prototype.service_request",
  "initial_state": "draft",
  "states": [
    {"id": "draft", "label": "Draft", "terminal": false},
    {"id": "review", "label": "Review", "terminal": false, "waiting": true, "wait_explanation": "Confirm the request details."},
    {"id": "submitted", "label": "Submitted", "terminal": true},
    {"id": "cancelled", "label": "Cancelled", "terminal": true}
  ],
  "commands": [
    {"id": "start", "input_schema": {"type": "object", "properties": {"confirmed": {"type": "boolean"}, "evidence_refs": {"type": "array", "items": {"type": "string"}}, "legacy_action": {"type": "string"}}, "additionalProperties": true}},
    {"id": "submit", "input_schema": {"type": "object", "properties": {"confirmed": {"type": "boolean"}, "evidence_refs": {"type": "array", "items": {"type": "string"}}, "legacy_action": {"type": "string"}}, "additionalProperties": true}},
    {"id": "retry", "input_schema": {"type": "object", "properties": {"confirmed": {"type": "boolean"}, "evidence_refs": {"type": "array", "items": {"type": "string"}}, "legacy_action": {"type": "string"}}, "additionalProperties": true}},
    {"id": "cancel", "input_schema": {"type": "object", "properties": {"confirmed": {"type": "boolean"}, "evidence_refs": {"type": "array", "items": {"type": "string"}}, "legacy_action": {"type": "string"}}, "additionalProperties": true}}
  ],
  "transitions": [
    {
      "schema": "adaos.workflow.transition.v1",
      "transition_id": "collect_request",
      "source": "draft",
      "target": "review",
      "trigger": {"kind": "command", "command": "start", "input_schema": {"type": "object", "properties": {"confirmed": {"type": "boolean"}, "evidence_refs": {"type": "array", "items": {"type": "string"}}, "legacy_action": {"type": "string"}}, "additionalProperties": true}},
      "context": {"target_resolution": "instance", "command_context_required": false},
      "authority": {"actors": ["user"], "permissions": []},
      "guards": [{"id": "always", "params": {}, "reason_code": "blocked"}],
      "concurrency": {"conflict_scope": "prototype", "requires_generation": true, "idempotency": "required"},
      "risk": {"class": "isolated_write", "side_effect": "reversible", "confirmation": "none"},
      "effect": {"activity": "builder.prototype.derive", "transaction": "outbox", "retry": "bounded", "compensation": null},
      "recovery": {"timeout_seconds": 30, "heartbeat_seconds": 5, "cancellation": "cooperative", "reconciliation": "required_on_unknown"},
      "outcomes": {"success": "target", "failure": "source", "input_required": "source", "cancelled": "source", "unknown": "source"},
      "evidence": {"required": false, "minimum": 0},
      "approval": {"required": false, "policy_refs": []},
      "async_reply": {"mode": "terminal", "reply_route": "origin"},
      "capability_requirements": {"required": [], "optional": ["buttons"], "fallback": "numbered_text"},
      "explanations": {"allowed": "Request details can be collected.", "rejected": "Request details cannot be collected.", "completed": "Request details collected."},
      "events": {"emitted": ["prototype.request.collected"], "outbox": true},
      "observability": {"audit_event": "prototype.request.collect", "redaction": "policy", "metrics": [], "trace": true},
      "migration": {"introduced_in": "1.0.0", "aliases": []}
    },
    {
      "schema": "adaos.workflow.transition.v1",
      "transition_id": "submit_request",
      "source": "review",
      "target": "submitted",
      "trigger": {"kind": "command", "command": "submit", "input_schema": {"type": "object", "properties": {"confirmed": {"type": "boolean"}, "evidence_refs": {"type": "array", "items": {"type": "string"}}, "legacy_action": {"type": "string"}}, "additionalProperties": true}},
      "context": {"target_resolution": "instance", "command_context_required": false},
      "authority": {"actors": ["user"], "permissions": []},
      "guards": [{"id": "input_equals", "params": {"field": "confirmed", "value": true}, "reason_code": "confirmation_required"}],
      "concurrency": {"conflict_scope": "prototype", "requires_generation": true, "idempotency": "required"},
      "risk": {"class": "isolated_write", "side_effect": "reversible", "confirmation": "none"},
      "effect": {"activity": "builder.prototype.derive", "transaction": "outbox", "retry": "bounded", "compensation": null},
      "recovery": {"timeout_seconds": 30, "heartbeat_seconds": 5, "cancellation": "cooperative", "reconciliation": "required_on_unknown"},
      "outcomes": {"success": "target", "failure": "source", "input_required": "source", "cancelled": "source", "unknown": "source"},
      "evidence": {"required": false, "minimum": 0},
      "approval": {"required": false, "policy_refs": []},
      "async_reply": {"mode": "terminal", "reply_route": "origin"},
      "capability_requirements": {"required": [], "optional": ["buttons"], "fallback": "numbered_text"},
      "explanations": {"allowed": "The request can be submitted.", "rejected": "Confirm the request first.", "completed": "Request submitted."},
      "events": {"emitted": ["prototype.request.submitted"], "outbox": true},
      "observability": {"audit_event": "prototype.request.submit", "redaction": "policy", "metrics": [], "trace": true},
      "migration": {"introduced_in": "1.0.0", "aliases": []}
    },
    {
      "schema": "adaos.workflow.transition.v1",
      "transition_id": "retry_request",
      "source": "review",
      "target": "review",
      "trigger": {"kind": "command", "command": "retry", "input_schema": {"type": "object", "properties": {"confirmed": {"type": "boolean"}, "evidence_refs": {"type": "array", "items": {"type": "string"}}, "legacy_action": {"type": "string"}}, "additionalProperties": true}},
      "context": {"target_resolution": "instance", "command_context_required": false},
      "authority": {"actors": ["user"], "permissions": []},
      "guards": [{"id": "always", "params": {}, "reason_code": "blocked"}],
      "concurrency": {"conflict_scope": "prototype", "requires_generation": true, "idempotency": "required"},
      "risk": {"class": "isolated_write", "side_effect": "reversible", "confirmation": "none"},
      "effect": {"activity": "builder.prototype.derive", "transaction": "outbox", "retry": "bounded", "compensation": null},
      "recovery": {"timeout_seconds": 30, "heartbeat_seconds": 5, "cancellation": "cooperative", "reconciliation": "required_on_unknown"},
      "outcomes": {"success": "target", "failure": "source", "input_required": "source", "cancelled": "source", "unknown": "source"},
      "evidence": {"required": false, "minimum": 0},
      "approval": {"required": false, "policy_refs": []},
      "async_reply": {"mode": "terminal", "reply_route": "origin"},
      "capability_requirements": {"required": [], "optional": ["buttons"], "fallback": "numbered_text"},
      "explanations": {"allowed": "Collection can be retried once.", "rejected": "Collection retry is blocked.", "completed": "Collection retried."},
      "events": {"emitted": ["prototype.request.retried"], "outbox": true},
      "observability": {"audit_event": "prototype.request.retry", "redaction": "policy", "metrics": [], "trace": true},
      "migration": {"introduced_in": "1.0.0", "aliases": []}
    },
    {
      "schema": "adaos.workflow.transition.v1",
      "transition_id": "cancel_request",
      "source": "review",
      "target": "cancelled",
      "trigger": {"kind": "command", "command": "cancel", "input_schema": {"type": "object", "properties": {"confirmed": {"type": "boolean"}, "evidence_refs": {"type": "array", "items": {"type": "string"}}, "legacy_action": {"type": "string"}}, "additionalProperties": true}},
      "context": {"target_resolution": "instance", "command_context_required": false},
      "authority": {"actors": ["user"], "permissions": []},
      "guards": [{"id": "always", "params": {}, "reason_code": "blocked"}],
      "concurrency": {"conflict_scope": "prototype", "requires_generation": true, "idempotency": "required"},
      "risk": {"class": "isolated_write", "side_effect": "reversible", "confirmation": "none"},
      "effect": {"activity": "builder.prototype.derive", "transaction": "outbox", "retry": "never", "compensation": null},
      "recovery": {"timeout_seconds": 30, "heartbeat_seconds": 5, "cancellation": "cooperative", "reconciliation": "required_on_unknown"},
      "outcomes": {"success": "target", "failure": "source", "input_required": "source", "cancelled": "target", "unknown": "source"},
      "evidence": {"required": false, "minimum": 0},
      "approval": {"required": false, "policy_refs": []},
      "async_reply": {"mode": "terminal", "reply_route": "origin"},
      "capability_requirements": {"required": [], "optional": ["buttons"], "fallback": "numbered_text"},
      "explanations": {"allowed": "The request can be cancelled.", "rejected": "Cancellation is blocked.", "completed": "Request cancelled."},
      "events": {"emitted": ["prototype.request.cancelled"], "outbox": true},
      "observability": {"audit_event": "prototype.request.cancel", "redaction": "policy", "metrics": [], "trace": true},
      "migration": {"introduced_in": "1.0.0", "aliases": []}
    }
  ],
  "subworkflows": [],
  "metadata": {"profile": "conversational_mvp", "prototype": true}
}
